{
  "$schema": "https://github.com/ChNanAn/technical-doc-parser/schemas/document.v1.schema.json",
  "schema_version": 1,
  "document_id": "fixture_native_text",
  "status": "complete",
  "source": {
    "filename": "motor-manual.pdf",
    "media_type": "application/pdf"
  },
  "producer": {
    "name": "technical-doc-parser",
    "version": "fixture"
  },
  "coordinate_space": {
    "unit": "pixel",
    "origin": "top_left",
    "bbox_format": "xyxy",
    "dpi": 200
  },
  "pages": [
    {
      "id": "page_1",
      "number": 1,
      "width": 1200,
      "height": 1600,
      "image": {
        "id": "page_1_image",
        "uri": "pages/page_1.png",
        "media_type": "image/png"
      }
    }
  ],
  "blocks": [
    {
      "id": "native_title",
      "type": "title",
      "page_id": "page_1",
      "bbox": [100, 100, 900, 180],
      "text": "Motor installation manual",
      "score": {
        "value": 0.99,
        "kind": "model_score"
      },
      "source_refs": [
        {
          "page_id": "page_1",
          "bbox": [100, 100, 900, 180],
          "text": "Motor installation manual",
          "kind": "pdf_text_layer"
        }
      ]
    },
    {
      "id": "native_body",
      "type": "paragraph",
      "page_id": "page_1",
      "bbox": [100, 240, 1080, 360],
      "text": "Disconnect the power supply before installation.",
      "source_refs": [
        {
          "page_id": "page_1",
          "bbox": [100, 240, 1080, 360],
          "kind": "pdf_text_layer"
        }
      ]
    }
  ],
  "warnings": []
}
